{
  "id": "aws.ecr",
  "name": "Amazon ECR",
  "vendor": "aws",
  "categories": ["containers"],
  "tags": ["containers", "registry"],
  "variants": ["default"],
  "defaultVariant": "default",
  "source": {
    "url": "https://aws.amazon.com/architecture/icons/",
    "license": "AWS Architecture Icons License"
  }
}
