{
  "id": "aws.eks",
  "name": "Amazon EKS",
  "vendor": "aws",
  "categories": ["containers"],
  "tags": ["containers", "kubernetes"],
  "variants": ["default"],
  "defaultVariant": "default",
  "source": {
    "url": "https://aws.amazon.com/architecture/icons/",
    "license": "AWS Architecture Icons License"
  }
}
