{
  "id": "aws.rds",
  "name": "Amazon RDS",
  "vendor": "aws",
  "categories": ["database"],
  "tags": ["relational"],
  "variants": ["default"],
  "defaultVariant": "default",
  "source": {
    "url": "https://aws.amazon.com/architecture/icons/",
    "license": "AWS Architecture Icons License"
  }
}
